{
  "day": 2,
  "book": 1,
  "week": 1,
  "title": "Ja sam Ana",
  "titleEn": "I am Ana",
  "theme": "Meeting Emir at Sebilj",
  "status": "draft",
  "reviewedAt": null,
  "reviewerNotes": "Full draft to Lesson 1 exemplar bar — ready for human review before publish.",
  "estimatedMinutes": 60,
  "storyBeat": "Ana meets Emir at the Sebilj fountain and learns to introduce herself.",
  "learningGoals": {
    "vocabulary": [
      "Personal pronouns: ja, ti, on, ona",
      "Introductions: zovem se, ime, iz, drago mi je",
      "Key place word: Sebilj"
    ],
    "grammar": [
      "Present of biti (to be): sam / si / je",
      "Ja sam… and Zovem se… for introductions",
      "Simple On je… / Ona je… sentences"
    ],
    "culture": [
      "Sebilj as Baščaršija’s meeting fountain",
      "Warm first meetings in Sarajevo"
    ]
  },
  "vocabulary": [
    {
      "bosnian": "ja",
      "english": "I",
      "pronunciation": "yah",
      "partOfSpeech": "pronoun",
      "example": "Ja sam Ana."
    },
    {
      "bosnian": "ti",
      "english": "you (informal singular)",
      "pronunciation": "tee",
      "partOfSpeech": "pronoun",
      "example": "Ti si Emir."
    },
    {
      "bosnian": "on",
      "english": "he",
      "pronunciation": "ohn",
      "partOfSpeech": "pronoun",
      "example": "On je iz Sarajeva."
    },
    {
      "bosnian": "ona",
      "english": "she",
      "pronunciation": "OH-nah",
      "partOfSpeech": "pronoun",
      "example": "Ona je Ana."
    },
    {
      "bosnian": "sam",
      "english": "am (I am)",
      "pronunciation": "sahm",
      "partOfSpeech": "verb",
      "example": "Ja sam Ana."
    },
    {
      "bosnian": "si",
      "english": "are (you are)",
      "pronunciation": "see",
      "partOfSpeech": "verb",
      "example": "Ti si Emir."
    },
    {
      "bosnian": "je",
      "english": "is (he/she/it is)",
      "pronunciation": "yeh",
      "partOfSpeech": "verb",
      "example": "On je vodič."
    },
    {
      "bosnian": "zovem se",
      "english": "my name is / I am called",
      "pronunciation": "ZOH-vem seh",
      "partOfSpeech": "phrase",
      "example": "Zovem se Ana."
    },
    {
      "bosnian": "ime",
      "english": "name",
      "pronunciation": "EE-meh",
      "partOfSpeech": "noun",
      "example": "Kako se zoveš? — Ime mi je Ana."
    },
    {
      "bosnian": "iz",
      "english": "from",
      "pronunciation": "eez",
      "partOfSpeech": "preposition",
      "example": "Ja sam iz Amerike."
    },
    {
      "bosnian": "drago mi je",
      "english": "nice to meet you",
      "pronunciation": "DRAH-go mee yeh",
      "partOfSpeech": "phrase",
      "example": "Drago mi je!"
    },
    {
      "bosnian": "Sebilj",
      "english": "Sebilj (wooden fountain in Baščaršija)",
      "pronunciation": "seh-BEEL",
      "partOfSpeech": "proper noun",
      "example": "Čekam kod Sebilja."
    },
    {
      "bosnian": "vodič",
      "english": "guide",
      "pronunciation": "VOH-dich",
      "partOfSpeech": "noun",
      "example": "Emir je vodič."
    },
    {
      "bosnian": "prijatelj",
      "english": "friend (male)",
      "pronunciation": "pree-YAH-telj",
      "partOfSpeech": "noun",
      "example": "On je prijatelj."
    }
  ],
  "grammar": [
    {
      "title": "biti — sam, si, je",
      "explanation": "The verb biti means to be. Beginners live on three short forms: ja sam (I am), ti si (you are), on/ona je (he/she is). You will hear longer forms (jesam, jesi…) in careful speech, but everyday talk loves the short ones. Put the pronoun first when you want clarity: Ja sam Ana.",
      "examples": [
        {
          "bosnian": "Ja sam Ana.",
          "english": "I am Ana."
        },
        {
          "bosnian": "Ti si Emir.",
          "english": "You are Emir."
        },
        {
          "bosnian": "On je vodič.",
          "english": "He is a guide."
        },
        {
          "bosnian": "Ona je iz Sarajeva.",
          "english": "She is from Sarajevo."
        }
      ]
    },
    {
      "title": "Two ways to introduce yourself",
      "explanation": "Ja sam Ana states identity with biti. Zovem se Ana means “I am called Ana / my name is Ana.” Both are natural. For “nice to meet you,” say Drago mi je — literally “it is dear to me.”",
      "examples": [
        {
          "bosnian": "Zovem se Ana.",
          "english": "My name is Ana."
        },
        {
          "bosnian": "Ja sam Emir.",
          "english": "I am Emir."
        },
        {
          "bosnian": "Drago mi je!",
          "english": "Nice to meet you!"
        }
      ]
    },
    {
      "title": "iz — saying where you are from",
      "explanation": "Use iz + place for origin: Ja sam iz Amerike. Emir je iz Sarajeva. You do not need full case tables yet — learn a few ready-made chunks and swap the place name.",
      "examples": [
        {
          "bosnian": "Ja sam iz Amerike.",
          "english": "I am from America."
        },
        {
          "bosnian": "Emir je iz Sarajeva.",
          "english": "Emir is from Sarajevo."
        },
        {
          "bosnian": "Ona je iz Mostara.",
          "english": "She is from Mostar."
        }
      ]
    }
  ],
  "culture": {
    "title": "Sebilj — where people meet",
    "body": "The Sebilj is a wooden fountain in the middle of Baščaršija’s main square. Locals and visitors use it as a landmark: “Kod Sebilja” means meet me at the fountain. Pigeons gather, photos happen, and first hellos often start here. Emir waits for Ana at Sebilj — a classic Sarajevo rendezvous.",
    "imageId": "sebilj-square"
  },
  "lessonBlocks": [
    {
      "id": "a",
      "title": "Lesson A — Pronouns and biti",
      "body": "Learn four pronouns today: ja (I), ti (you informal), on (he), ona (she). Pair them with biti: ja sam, ti si, on je, ona je. Say them aloud until they feel automatic. Then build tiny truths: Ja sam Ana. Ti si Emir. On je vodič. Ona je prijateljica — we will meet more “she” words soon; for now Ona je Ana is enough. Tip: beginners often drop the pronoun when the verb form is clear (Sam Ana), but keeping Ja sam Ana is clearer and friendlier while you learn.",
      "tips": [
        "Drill: ja sam · ti si · on je · ona je",
        "Keep the pronoun when you introduce yourself: Ja sam…"
      ]
    },
    {
      "id": "b",
      "title": "Lesson B — Meeting Emir",
      "body": "At Sebilj, Ana needs a meeting script. Start with a greeting from Lesson 1 (Zdravo! or Dobar dan!). Then: Zovem se Ana. Or: Ja sam Ana. Add origin if you want: Ja sam iz Amerike. When Emir answers, reply Drago mi je! Listen for On je Emir / Ja sam Emir / Zovem se Emir — all fine. End with a smile and maybe Hvala when he offers help. Tomorrow you will drink kahva with Amira; today you only need to be Ana.",
      "tips": [
        "Meeting kit: Zdravo → Ja sam… / Zovem se… → Drago mi je",
        "Reuse Lesson 1 greetings; do not invent new ones yet"
      ]
    }
  ],
  "conversation": {
    "title": "Kod Sebilja",
    "setting": "Baščaršija square by the Sebilj fountain. Pigeons scatter. Emir holds a small sign that says ANA.",
    "lines": [
      {
        "speaker": "Emir",
        "bosnian": "Zdravo! Ti si Ana?",
        "english": "Hello! Are you Ana?"
      },
      {
        "speaker": "Ana",
        "bosnian": "Da! Ja sam Ana. Zovem se Ana.",
        "english": "Yes! I am Ana. My name is Ana."
      },
      {
        "speaker": "Emir",
        "bosnian": "Drago mi je! Ja sam Emir.",
        "english": "Nice to meet you! I am Emir."
      },
      {
        "speaker": "Ana",
        "bosnian": "Drago mi je, Emir. Ti si iz Sarajeva?",
        "english": "Nice to meet you, Emir. Are you from Sarajevo?"
      },
      {
        "speaker": "Emir",
        "bosnian": "Da. Ja sam iz Sarajeva. On — Sebilj — je tu.",
        "english": "Yes. I am from Sarajevo. That — Sebilj — is here."
      },
      {
        "speaker": "Ana",
        "bosnian": "Hvala! Ti si vodič?",
        "english": "Thank you! Are you a guide?"
      },
      {
        "speaker": "Emir",
        "bosnian": "Da, ja sam vodič. Idemo!",
        "english": "Yes, I am a guide. Let’s go!"
      },
      {
        "speaker": "Narrator",
        "bosnian": "Mrvica gleda. Sutra: kahva.",
        "english": "Mrvica watches. Tomorrow: coffee."
      }
    ]
  },
  "puzzles": [
    {
      "id": "p1",
      "type": "match",
      "title": "Match the forms",
      "prompt": "Match each Bosnian form to English.",
      "items": [
        {
          "left": "ja sam",
          "right": "I am"
        },
        {
          "left": "ti si",
          "right": "you are"
        },
        {
          "left": "on je",
          "right": "he is"
        },
        {
          "left": "zovem se",
          "right": "my name is"
        },
        {
          "left": "drago mi je",
          "right": "nice to meet you"
        }
      ]
    },
    {
      "id": "p2",
      "type": "scramble",
      "title": "Unscramble the introductions",
      "prompt": "Unscramble to make today’s phrases (spaces ignored in checking — type the full phrase).",
      "items": [
        {
          "scrambled": "sam ja Ana",
          "answer": "ja sam ana"
        },
        {
          "scrambled": "se zovem Emir",
          "answer": "zovem se emir"
        },
        {
          "scrambled": "je mi drago",
          "answer": "drago mi je"
        }
      ]
    }
  ],
  "practice": [
    {
      "id": "pr1",
      "prompt": "Complete: Ja ___ Ana. (I am)",
      "hint": "Short form of biti for ‘I’",
      "answer": "sam"
    },
    {
      "id": "pr2",
      "prompt": "Complete: Ti ___ Emir. (you are)",
      "hint": "Short form for ‘you’",
      "answer": "si"
    },
    {
      "id": "pr3",
      "prompt": "Complete: On ___ vodič. (he is)",
      "hint": "One short word",
      "answer": "je"
    },
    {
      "id": "pr4",